{
  "$schema": "https://raw.githubusercontent.com/Abenor-Labs/z-ui/main/registry/schema/registry.schema.json",
  "name": "z-ui",
  "version": "0.1.0",
  "homepage": "https://github.com/Abenor-Labs/z-ui",
  "items": [
    {
      "name": "disclosure",
      "type": "registry:component",
      "category": "state-morphing",
      "path": "components/disclosure"
    },
    {
      "name": "hold-drain",
      "type": "registry:component",
      "category": "tactile-feedback",
      "path": "components/hold-drain"
    },
    {
      "name": "late-critique",
      "type": "registry:component",
      "category": "input-utility",
      "path": "components/late-critique"
    },
    {
      "name": "scramble-reveal",
      "type": "registry:component",
      "category": "state-morphing",
      "path": "components/scramble-reveal"
    }
  ]
}
